9184205	Odom A, Muir S, Lim E, Toffaletti DL, Perfect J, Heitman J. (1997). "Calcineurin is required for virulence of Cryptococcus neoformans." EMBO J 16(10): 2576-2589. 10.1093/emboj/16.10.2576.
15205912	Solomon PS, Oliver RP. (2004). "Functional characterisation of glyoxalase I from the fungal wheat pathogen Stagonospora nodorum." Curr Genet 46(2): 115-121. 10.1007/s00294-004-0514-8.
8704997	Pitkin JW, Panaccione DG, Walton JD. (1996). "A putative cyclic peptide efflux pump encoded by the TOXA gene of the plant-pathogenic fungus Cochliobolus carbonum." Microbiology 142 ( Pt 6)(): 1557-1565. .
9100380	Crowhurst RN, Binnie SJ, Bowen JK, Hawthorne BT, Plummer KM, Rees-George J, Rikkerink EH, Templeton MD. (1997). "Effect of disruption of a cutinase gene (cutA) on virulence and tissue specificity of Fusarium solani f. sp. cucurbitae race 2 toward Cucurbita maxima and C. moschata." Mol Plant Microbe Interact 10(3): 355-368. 10.1094/mpmi.1997.10.3.355.
24372531	Martinez-Marcos M, De la Cuesta-Benjumea C. (2014). "How women caregivers deal with their own long-term illness: a qualitative study." J Adv Nurs 70(8): 1825-1836. 10.1111/jan.12341.
22649560	Lin Y, Son H, Min K, Lee J, Choi GJ, Kim JC, Lee YW. (2012). "A putative transcription factor MYT2 regulates perithecium size in the ascomycete Gibberella zeae." PLoS One 7(5): e37859. 10.1371/journal.pone.0037859.
19621226	Zhou J, Lin CZ, Zheng XZ, Lin XJ, Sang WJ, Wang SH, Wang ZH, Ebbole D, Lu GD. (2009). "Functional analysis of an alpha-1,2-mannosidase from Magnaporthe oryzae." Curr Genet 55(4): 485-496. 10.1007/s00294-009-0261-y.
23692030	de Lange O, Schreiber T, Schandry N, Radeck J, Braun KH, Koszinowski J, Heuer H, Strauß A, Lahaye T. (2013). "Breaking the DNA-binding code of Ralstonia solanacearum TAL effectors provides new possibilities to generate plant resistance genes against bacterial wilt disease." New Phytol 199(3): 773-786. 10.1111/nph.12324.
10209038	Brandhorst TT, Wüthrich M, Warner T, Klein B. (1999). "Targeted gene disruption reveals an adhesin indispensable for pathogenicity of Blastomyces dermatitidis." J Exp Med 189(8): 1207-1216. 10.1084/jem.189.8.1207.
23406519	Balesdent MH, Fudal I, Ollivier B, Bally P, Grandaubert J, Eber F, Chèvre AM, Leflon M, Rouxel T. (2013). "The dispensable chromosome of Leptosphaeria maculans shelters an effector gene conferring avirulence towards Brassica rapa." New Phytol 198(3): 887-898. 10.1111/nph.12178.
20618705	Nadal M, Gold SE. (2010). "The autophagy genes ATG8 and ATG1 affect morphogenesis and pathogenicity in Ustilago maydis." Mol Plant Pathol 11(4): 463-478. 10.1111/j.1364-3703.2010.00620.x.
10792722	Alspaugh JA, Cavallo LM, Perfect JR, Heitman J. (2000). "RAS1 regulates filamentation, mating and growth at high temperature of Cryptococcus neoformans." Mol Microbiol 36(2): 352-365. 10.1046/j.1365-2958.2000.01852.x.
8589423	Hinsch M, Staskawicz B. (1996). "Identification of a new Arabidopsis disease resistance locus, RPs4, and cloning of the corresponding avirulence gene, avrRps4, from Pseudomonas syringae pv. pisi." Mol Plant Microbe Interact 9(1): 55-61. .
12146755	Clemons KV, Miller TK, Selitrennikoff CP, Stevens DA. (2002). "fos-1, a putative histidine kinase as a virulence factor for systemic aspergillosis." Med Mycol 40(3): 259-262. 10.1080/mmy.40.3.259.262.
15811992	Kim JE, Han KH, Jin J, Kim H, Kim JC, Yun SH, Lee YW. (2005). "Putative polyketide synthase and laccase genes for biosynthesis of aurofusarin in Gibberella zeae." Appl Environ Microbiol 71(4): 1701-1708. 10.1128/aem.71.4.1701-1708.2005.
11270409	Selitrennikoff CP, Alex L, Miller TK, Clemons KV, Simon MI, Stevens DA. (2001). "COS-l, a putative two-component histidine kinase of Candida albicans, is an in vivo virulence factor." Med Mycol 39(1): 69-74. 10.1080/mmy.39.1.69.74.
15590822	Bahn YS, Hicks JK, Giles SS, Cox GM, Heitman J. (2004). "Adenylyl cyclase-associated protein Aca1 regulates virulence and differentiation of Cryptococcus neoformans via the cyclic AMP-protein kinase A cascade." Eukaryot Cell 3(6): 1476-1491. 10.1128/ec.3.6.1476-1491.2004.
17379549	Zwiers LH, Roohparvar R, de Waard MA. (2007). "MgAtr7, a new type of ABC transporter from Mycosphaerella graminicola involved in iron homeostasis." Fungal Genet Biol 44(9): 853-863. 10.1016/j.fgb.2007.02.001.
24905535	Herrero-de-Dios C, Alonso-Monge R, Pla J. (2014). "The lack of upstream elements of the Cek1 and Hog1 mediated pathways leads to a synthetic lethal phenotype upon osmotic stress in Candida albicans." Fungal Genet Biol 69(): 31-42. 10.1016/j.fgb.2014.05.010.
15701800	Brefort T, Müller P, Kahmann R. (2005). "The high-mobility-group domain transcription factor Rop1 is a direct regulator of prf1 in Ustilago maydis." Eukaryot Cell 4(2): 379-391. 10.1128/ec.4.2.379-391.2005.
9546185	Scott-Craig JS, Cheng YQ, Cervone F, De Lorenzo G, Pitkin JW, Walton JD. (1998). "Targeted mutants of Cochliobolus carbonum lacking the two major extracellular polygalacturonases." Appl Environ Microbiol 64(4): 1497-1503. .
12455985	Shen WC, Davidson RC, Cox GM, Heitman J. (2002). "Pheromones stimulate mating and differentiation via paracrine and autocrine signaling in Cryptococcus neoformans." Eukaryot Cell 1(3): 366-377. 10.1128/ec.1.3.366-377.2002.
19958144	Yang J, Zhao X, Sun J, Kang Z, Ding S, Xu JR, Peng YL. (2010). "A novel protein Com1 is required for normal conidium morphology and full virulence in Magnaporthe oryzae." Mol Plant Microbe Interact 23(1): 112-123. 10.1094/mpmi-23-1-0112.
21205158	Song W, Wang H, Chen J. (2011). "Candida albicans Sfl2, a temperature-induced transcriptional regulator, is required for virulence in a murine gastrointestinal infection model." FEMS Yeast Res 11(2): 209-222. 10.1111/j.1567-1364.2010.00710.x.
15546361	Lim MT, Kunkel BN. (2004). "The Pseudomonas syringae type III effector AvrRpt2 promotes virulence independently of RIN4, a predicted virulence target in Arabidopsis thaliana." Plant J 40(5): 790-798. 10.1111/j.1365-313x.2004.02251.x.
7591094	Becker JM, Henry LK, Jiang W, Koltin Y. (1995). "Reduced virulence of Candida albicans mutants affected in multidrug resistance." Infect Immun 63(11): 4515-4518. .
7549480	Sweigard JA, Carroll AM, Kang S, Farrall L, Chumley FG, Valent B. (1995). "Identification, cloning, and characterization of PWL2, a gene for host species specificity in the rice blast fungus." Plant Cell 7(8): 1221-1233. 10.1105/tpc.7.8.1221.
19337737	Qiu D, Mao J, Yang X, Zeng H. (2009). "Expression of an elicitor-encoding gene from Magnaporthe grisea enhances resistance against blast disease in transgenic rice." Plant Cell Rep 28(6): 925-933. 10.1007/s00299-009-0698-y.
23252416	Wang Y, Lim L, DiGuistini S, Robertson G, Bohlmann J, Breuil C. (2013). "A specialized ABC efflux transporter GcABC-G1 confers monoterpene resistance to Grosmannia clavigera, a bark beetle-associated fungal pathogen of pine trees." New Phytol 197(3): 886-898. 10.1111/nph.12063.
21143319	Berndt P, Lanver D, Kahmann R. (2010). "The AGC Ser/Thr kinase Aga1 is essential for appressorium formation and maintenance of the actin cytoskeleton in the smut fungus Ustilago maydis." Mol Microbiol 78(6): 1484-1499. 10.1111/j.1365-2958.2010.07422.x.
20639448	Saunders DG, Dagdas YF, Talbot NJ. (2010). "Spatial uncoupling of mitosis and cytokinesis during appressorium-mediated plant infection by the rice blast fungus Magnaporthe oryzae." Plant Cell 22(7): 2417-2428. 10.1105/tpc.110.074492.
15937188	Guo M, Chancey ST, Tian F, Ge Z, Jamir Y, Alfano JR. (2005). "Pseudomonas syringae type III chaperones ShcO1, ShcS1, and ShcS2 facilitate translocation of their cognate effectors and can substitute for each other in the secretion of HopO1-1." J Bacteriol 187(12): 4257-4269. 10.1128/jb.187.12.4257-4269.2005.
17073302	Vencato M, Tian F, Alfano JR, Buell CR, Cartinhour S, DeClerck GA, Guttman DS, Stavrinides J, Joardar V, Lindeberg M, Bronstein PA, Mansfield JW, Myers CR, Collmer A, Schneider DJ. (2006). "Bioinformatics-enabled identification of the HrpL regulon and type III secretion system effector proteins of Pseudomonas syringae pv. phaseolicola 1448A." Mol Plant Microbe Interact 19(11): 1193-1206. 10.1094/mpmi-19-1193.
10066176	Staab JF, Bradway SD, Fidel PL, Sundstrom P. (1999). "Adhesive and mammalian transglutaminase substrate properties of Candida albicans Hwp1." Science 283(5407): 1535-1538. 10.1126/science.283.5407.1535.
12423017	Hou Z, Xue C, Peng Y, Katan T, Kistler HC, Xu JR. (2002). "A mitogen-activated protein kinase gene (MGV1) in Fusarium graminearum is required for female fertility, heterokaryon formation, and plant infection." Mol Plant Microbe Interact 15(11): 1119-1127. 10.1094/mpmi.2002.15.11.1119.
20495056	IpCho SV, Tan KC, Koh G, Gummer J, Oliver RP, Trengove RD, Solomon PS. (2010). "The transcription factor StuA regulates central carbon metabolism, mycotoxin production, and effector gene expression in the wheat pathogen Stagonospora nodorum." Eukaryot Cell 9(7): 1100-1108. 10.1128/ec.00064-10.
15760450	Park H, Myers CL, Sheppard DC, Phan QT, Sanchez AA, E Edwards J, Filler SG. (2005). "Role of the fungal Ras-protein kinase A pathway in governing epithelial cell interactions during oropharyngeal candidiasis." Cell Microbiol 7(4): 499-510. 10.1111/j.1462-5822.2004.00476.x.
11006342	Thines E, Weber RW, Talbot NJ. (2000). "MAP kinase and protein kinase A-dependent mobilization of triacylglycerol and glycogen during appressorium turgor generation by Magnaporthe grisea." Plant Cell 12(9): 1703-1718. 10.1105/tpc.12.9.1703.
24883112	Heimesaat MM, Fischer A, Alutis M, Grundmann U, Boehm M, Tegtmeyer N, Göbel UB, Kühl AA, Bereswill S, Backert S. (2014). "The impact of serine protease HtrA in apoptosis, intestinal immune responses and extra-intestinal histopathology during Campylobacter jejuni infection of infant mice." Gut Pathog 6(): 16. 10.1186/1757-4749-6-16.
11967069	Fu Y, Ibrahim AS, Sheppard DC, Chen YC, French SW, Cutler JE, Filler SG, Edwards JE Jr. (2002). "Candida albicans Als1p: an adhesin that is a downstream effector of the EFG1 filamentation pathway." Mol Microbiol 44(1): 61-72. 10.1046/j.1365-2958.2002.02873.x.
11737651	Erickson T, Liu L, Gueyikian A, Zhu X, Gibbons J, Williamson PR. (2001). "Multiple virulence factors of Cryptococcus neoformans are dependent on VPH1." Mol Microbiol 42(4): 1121-1131. 10.1046/j.1365-2958.2001.02712.x.
9683476	Zaragoza O, Blazquez MA, Gancedo C. (1998). "Disruption of the Candida albicans TPS1 gene encoding trehalose-6-phosphate synthase impairs formation of hyphae and decreases infectivity." J Bacteriol 180(15): 3809-3815. .
24372513	Xie M, Cao N, Ding S. (2014). "Small molecules for cell reprogramming and heart repair: progress and perspective." ACS Chem Biol 9(1): 34-44. 10.1021/cb400865w.
9694829	Timpel C, Strahl-Bolsinger S, Ziegelbauer K, Ernst JF. (1998). "Multiple functions of Pmt1p-mediated protein O-mannosylation in the fungal pathogen Candida albicans." J Biol Chem 273(33): 20837-20846. 10.1074/jbc.273.33.20837.
9636208	Buurman ET, Westwater C, Hube B, Brown AJ, Odds FC, Gow NA. (1998). "Molecular analysis of CaMnt1p, a mannosyl transferase important for adhesion and virulence of Candida albicans." Proc Natl Acad Sci U S A 95(13): 7670-7675. 10.1073/pnas.95.13.7670.
11287622	D'Souza CA, Alspaugh JA, Yue C, Harashima T, Cox GM, Perfect JR, Heitman J. (2001). "Cyclic AMP-dependent protein kinase controls virulence of the fungal pathogen Cryptococcus neoformans." Mol Cell Biol 21(9): 3179-3191. 10.1128/mcb.21.9.3179-3191.2001.
15020411	Ohara T, Inoue I, Namiki F, Kunoh H, Tsuge T. (2004). "REN1 is required for development of microconidia and macroconidia, but not of chlamydospores, in the plant pathogenic fungus Fusarium oxysporum." Genetics 166(1): 113-124. 10.1534/genetics.166.1.113.
15765146	Panepinto J, Liu L, Ramos J, Zhu X, Valyi-Nagy T, Eksi S, Fu J, Jaffe HA, Wickes B, Williamson PR. (2005). "The DEAD-box RNA helicase Vad1 regulates multiple virulence-associated genes in Cryptococcus neoformans." J Clin Invest 115(3): 632-641. 10.1172/jci23048.
18065558	Ferrari S, Galletti R, Pontiggia D, Manfredini C, Lionetti V, Bellincampi D, Cervone F, De Lorenzo G. (2008). "Transgenic expression of a fungal endo-polygalacturonase increases plant resistance to pathogens and reduces auxin sensitivity." Plant Physiol 146(2): 669-681. 10.1104/pp.107.109686.
9043115	Jiang W, Gerhold D, Kmiec EB, Hauser M, Becker JM, Koltin Y. (1997). "The topoisomerase I gene from Candida albicans." Microbiology 143 ( Pt 2)(): 377-386. .
11179356	Feng B, Wang X, Hauser M, Kaufmann S, Jentsch S, Haase G, Becker JM, Szaniszlo PJ. (2001). "Molecular cloning and characterization of WdPKS1, a gene involved in dihydroxynaphthalene melanin biosynthesis and virulence in Wangiella (Exophiala) dermatitidis." Infect Immun 69(3): 1781-1794. 10.1128/iai.69.3.1781-1794.2001.
16258033	Castillo-Lluva S, Pérez-Martín J. (2005). "The induction of the mating program in the phytopathogen Ustilago maydis is controlled by a G1 cyclin." Plant Cell 17(12): 3544-3560. 10.1105/tpc.105.036319.
12940995	Zheng XD, Wang YM, Wang Y. (2003). "CaSPA2 is important for polarity establishment and maintenance in Candida albicans." Mol Microbiol 49(5): 1391-1405. 10.1046/j.1365-2958.2003.03646.x.
20831406	Li Y, Liang S, Yan X, Wang H, Li D, Soanes DM, Talbot NJ, Wang Z, Wang Z. (2010). "Characterization of MoLDB1 required for vegetative growth, infection-related morphogenesis, and pathogenicity in the rice blast fungus Magnaporthe oryzae." Mol Plant Microbe Interact 23(10): 1260-1274. 10.1094/mpmi-03-10-0052.
11043465	Krüger J, Loubradou G, Wanner G, Regenfelder E, Feldbrügge M, Kahmann R. (2000). "Activation of the cAMP pathway in Ustilago maydis reduces fungal proliferation and teliospore formation in plant tumors." Mol Plant Microbe Interact 13(10): 1034-1040. 10.1094/mpmi.2000.13.10.1034.
22970788	Santhanam P, Thomma BP. (2013). "Verticillium dahliae Sge1 differentially regulates expression of candidate effector genes." Mol Plant Microbe Interact 26(2): 249-256. 10.1094/mpmi-08-12-0198-r.
15345450	Maeda Y, Kiba A, Ohnishi K, Hikichi Y. (2004). "Implications of amino acid substitutions in GyrA at position 83 in terms of oxolinic acid resistance in field isolates of Burkholderia glumae, a causal agent of bacterial seedling rot and grain rot of rice." Appl Environ Microbiol 70(9): 5613-5620. 10.1128/aem.70.9.5613-5620.2004.
23452277	Shin JH, Kim JE, Malapi-Wight M, Choi YE, Shaw BD, Shim WB. (2013). "Protein phosphatase 2A regulatory subunits perform distinct functional roles in the maize pathogen Fusarium verticillioides." Mol Plant Pathol 14(5): 518-529. 10.1111/mpp.12023.
11971145	Viaud MC, Balhadère PV, Talbot NJ. (2002). "A Magnaporthe grisea cyclophilin acts as a virulence determinant during plant infection." Plant Cell 14(4): 917-930. 10.1105/tpc.010389.
23145783	Taguchi F, Ichinose Y. (2013). "Virulence factor regulator (Vfr) controls virulence-associated phenotypes in Pseudomonas syringae pv. tabaci 6605 by a quorum sensing-independent mechanism." Mol Plant Pathol 14(3): 279-292. 10.1111/mpp.12003.
23125349	Pierce JV, Dignard D, Whiteway M, Kumamoto CA. (2013). "Normal adaptation of Candida albicans to the murine gastrointestinal tract requires Efg1p-dependent regulation of metabolic and host defense genes." Eukaryot Cell 12(1): 37-49. 10.1128/ec.00236-12.
9924993	Mahé E, Vossen P, Van den Hooven HW, Le-Nguyen D, Vervoort J, De Wit PJ. (1998). "Solid-phase synthesis, conformational analysis, and biological activity of AVR9 elicitor peptides of the fungal tomato pathogen Cladosporium fulvum." J Pept Res 52(6): 482-494. .
9748287	Leidich SD, Ibrahim AS, Fu Y, Koul A, Jessup C, Vitullo J, Fonzi W, Mirbod F, Nakashima S, Nozawa Y, Ghannoum MA. (1998). "Cloning and disruption of caPLB1, a phospholipase B gene involved in the pathogenicity of Candida albicans." J Biol Chem 273(40): 26078-26086. 10.1074/jbc.273.40.26078.
23417089	Li W, Yadeta KA, Elmore JM, Coaker G. (2013). "The Pseudomonas syringae effector HopQ1 promotes bacterial virulence and interacts with tomato 14-3-3 proteins in a phosphorylation-dependent manner." Plant Physiol 161(4): 2062-2074. 10.1104/pp.112.211748.
20100876	Miyazaki T, Yamauchi S, Inamine T, Nagayoshi Y, Saijo T, Izumikawa K, Seki M, Kakeya H, Yamamoto Y, Yanagihara K, Miyazaki Y, Kohno S. (2010). "Roles of calcineurin and Crz1 in antifungal susceptibility and virulence of Candida glabrata." Antimicrob Agents Chemother 54(4): 1639-1643. 10.1128/aac.01364-09.
15225327	Ding Y, Davis BM, Waldor MK. (2004). "Hfq is essential for Vibrio cholerae virulence and downregulates sigma expression." Mol Microbiol 53(1): 345-354. 10.1111/j.1365-2958.2004.04142.x.
9832321	Langfelder K, Jahn B, Gehringer H, Schmidt A, Wanner G, Brakhage AA. (1998). "Identification of a polyketide synthase gene (pksP) of Aspergillus fumigatus involved in conidial pigment biosynthesis and virulence." Med Microbiol Immunol 187(2): 79-89. 10.1007/s004300050077.
23139737	Puri S, Kumar R, Chadha S, Tati S, Conti HR, Hube B, Cullen PJ, Edgerton M. (2012). "Secreted aspartic protease cleavage of Candida albicans Msb2 activates Cek1 MAPK signaling affecting biofilm formation and oropharyngeal candidiasis." PLoS One 7(11): e46020. 10.1371/journal.pone.0046020.
11705974	Singh P, Ghosh S, Datta A. (2001). "Attenuation of virulence and changes in morphology in Candida albicans by disruption of the N-acetylglucosamine catabolic pathway." Infect Immun 69(12): 7898-7903. 10.1128/iai.69.12.7898-7903.2001.
15853881	Kaito C, Kurokawa K, Matsumoto Y, Terao Y, Kawabata S, Hamada S, Sekimizu K. (2005). "Silkworm pathogenic bacteria infection model for identification of novel virulence genes." Mol Microbiol 56(4): 934-944. 10.1111/j.1365-2958.2005.04596.x.
23785289	Üstün S, Bartetzko V, Börnke F. (2013). "The Xanthomonas campestris type III effector XopJ targets the host cell proteasome to suppress salicylic-acid mediated plant defence." PLoS Pathog 9(6): e1003427. 10.1371/journal.ppat.1003427.
19754836	Yang Y, Zhang H, Li G, Li W, Wang X, Song F. (2009). "Ectopic expression of MgSM1, a Cerato-platanin family protein from Magnaporthe grisea, confers broad-spectrum disease resistance in Arabidopsis." Plant Biotechnol J 7(8): 763-777. 10.1111/j.1467-7652.2009.00442.x.
20700446	Heimel K, Scherer M, Vranes M, Wahl R, Pothiratana C, Schuler D, Vincon V, Finkernagel F, Flor-Parra I, Kämper J. (2010). "The transcription factor Rbf1 is the master regulator for b-mating type controlled pathogenic development in Ustilago maydis." PLoS Pathog 6(8): e1001035. 10.1371/journal.ppat.1001035.
23387470	Shnaiderman C, Miyara I, Kobiler I, Sherman A, Prusky D. (2013). "Differential activation of ammonium transporters during the accumulation of ammonia by Colletotrichum gloeosporioides and its effect on appressoria formation and pathogenicity." Mol Plant Microbe Interact 26(3): 345-355. 10.1094/mpmi-07-12-0170-r.
11876422	Fleissner A, Sopalla C, Weltring KM. (2002). "An ATP-binding cassette multidrug-resistance transporter is necessary for tolerance of Gibberella pulicaris to phytoalexins and virulence on potato tubers." Mol Plant Microbe Interact 15(2): 102-108. 10.1094/mpmi.2002.15.2.102.
24895305	Bartek IL, Woolhiser LK, Baughn AD, Basaraba RJ, Jacobs WR Jr, Lenaerts AJ, Voskuil MI. (2014). "Mycobacterium tuberculosis Lsr2 is a global transcriptional regulator required for adaptation to changing oxygen levels and virulence." MBio 5(3): e01106-14. 10.1128/mbio.01106-14.
14500538	Cheng S, Nguyen MH, Zhang Z, Jia H, Handfield M, Clancy CJ. (2003). "Evaluation of the roles of four Candida albicans genes in virulence by using gene disruption strains that express URA3 from the native locus." Infect Immun 71(10): 6101-6103. 10.1128/iai.71.10.6101-6103.2003.
10766761	Thomson LM, Bates S, Yamazaki S, Arisawa M, Aoki Y, Gow NA. (2000). "Functional characterization of the Candida albicans MNT1 mannosyltransferase expressed heterologously in Pichia pastoris." J Biol Chem 275(25): 18933-18938. 10.1074/jbc.m909699199.
12971599	Shim WB, Dunkle LD. (2003). "CZK3, a MAP kinase kinase kinase homolog in Cercospora zeae-maydis, regulates cercosporin biosynthesis, fungal development, and pathogenesis." Mol Plant Microbe Interact 16(9): 760-768. 10.1094/mpmi.2003.16.9.760.
22951982	Castanys-Muñoz E, Brown E, Coombs GH, Mottram JC. (2012). "Leishmania mexicana metacaspase is a negative regulator of amastigote proliferation in mammalian cells." Cell Death Dis 3(): e385. 10.1038/cddis.2012.113.
25172854	Ramos LS, Lehman BL, Peter KA, McNellis TW. (2014). "Mutation of the Erwinia amylovora argD gene causes arginine auxotrophy, nonpathogenicity in apples, and reduced virulence in pears." Appl Environ Microbiol 80(21): 6739-6749. 10.1128/aem.02404-14.
10931947	Rogers LM, Kim YK, Guo W, González-Candelas L, Li D, Kolattukudy PE. (2000). "Requirement for either a host- or pectin-induced pectate lyase for infection of Pisum sativum by Nectria hematococca." Proc Natl Acad Sci U S A 97(17): 9813-9818. 10.1073/pnas.160271497.
12933837	Chang YC, Miller GF, Kwon-Chung KJ. (2003). "Importance of a developmentally regulated pheromone receptor of Cryptococcus neoformans for virulence." Infect Immun 71(9): 4953-4960. 10.1128/iai.71.9.4953-4960.2003.
10383767	Allaoui A, François C, Zemzoumi K, Guilvard E, Ouaissi A. (1999). "Intracellular growth and metacyclogenesis defects in Trypanosoma cruzi carrying a targeted deletion of a Tc52 protein-encoding allele." Mol Microbiol 32(6): 1273-1286. 10.1046/j.1365-2958.1999.01440.x.
17542924	Tanaka S, Yamada K, Yabumoto K, Fujii S, Huser A, Tsuji G, Koga H, Dohi K, Mori M, Shiraishi T, O'Connell R, Kubo Y. (2007). "Saccharomyces cerevisiae SSD1 orthologues are essential for host infection by the ascomycete plant pathogens Colletotrichum lagenarium and Magnaporthe grisea." Mol Microbiol 64(5): 1332-1349. 10.1111/j.1365-2958.2007.05742.x.
8672814	Perpetua NS, Kubo Y, Yasuda N, Takano Y, Furusawa I. (1996). "Cloning and characterization of a melanin biosynthetic THR1 reductase gene essential for appressorial penetration of Colletotrichum lagenarium." Mol Plant Microbe Interact 9(5): 323-329. .
14614821	de Jesús-Berríos M, Liu L, Nussbaum JC, Cox GM, Stamler JS, Heitman J. (2003). "Enzymes that counteract nitrosative stress promote fungal virulence." Curr Biol 13(22): 1963-1968. 10.1016/j.cub.2003.10.029.
11298769	Yamada-Okabe T, Sakamori Y, Mio T, Yamada-Okabe H. (2001). "Identification and characterization of the genes for N-acetylglucosamine kinase and N-acetylglucosamine-phosphate deacetylase in the pathogenic fungus Candida albicans." Eur J Biochem 268(8): 2498-2505. 10.1046/j.1432-1327.2001.02135.x.
16420354	Doehlemann G, Berndt P, Hahn M. (2006). "Different signalling pathways involving a Galpha protein, cAMP and a MAP kinase control germination of Botrytis cinerea conidia." Mol Microbiol 59(3): 821-835. 10.1111/j.1365-2958.2005.04991.x.
19923912	Liu TB, Liu XH, Lu JP, Zhang L, Min H, Lin FC. (2010). "The cysteine protease MoAtg4 interacts with MoAtg8 and is required for differentiation and pathogenesis in Magnaporthe oryzae." Autophagy 6(1): 74-85. 10.4161/auto.6.1.10438.
12207705	Hava DL, Camilli A. (2002). "Large-scale identification of serotype 4 Streptococcus pneumoniae virulence factors." Mol Microbiol 45(5): 1389-1406. .
20675574	Ding SL, Liu W, Iliuk A, Ribot C, Vallet J, Tao A, Wang Y, Lebrun MH, Xu JR. (2010). "The tig1 histone deacetylase complex regulates infectious growth in the rice blast fungus Magnaporthe oryzae." Plant Cell 22(7): 2495-2508. 10.1105/tpc.110.074302.
10875335	Johnson RD, Johnson L, Itoh Y, Kodama M, Otani H, Kohmoto K. (2000). "Cloning and characterization of a cyclic peptide synthetase gene from Alternaria alternata apple pathotype whose product is involved in AM-toxin synthesis and pathogenicity." Mol Plant Microbe Interact 13(7): 742-753. 10.1094/mpmi.2000.13.7.742.
21439008	Laforet L, Moreno I, Sánchez-Fresneda R, Martínez-Esparza M, Martínez JP, Argüelles JC, de Groot PW, Valentín-Gomez E. (2011). "Pga26 mediates filamentation and biofilm formation and is required for virulence in Candida albicans." FEMS Yeast Res 11(5): 389-397. 10.1111/j.1567-1364.2011.00727.x.
16267276	Cao F, Lane S, Raniga PP, Lu Y, Zhou Z, Ramon K, Chen J, Liu H. (2006). "The Flo8 transcription factor is essential for hyphal development and virulence in Candida albicans." Mol Biol Cell 17(1): 295-307. 10.1091/mbc.e05-06-0502.
22202230	Douglas LM, Wang HX, Keppler-Ross S, Dean N, Konopka JB. (2012). "Sur7 promotes plasma membrane organization and is needed for resistance to stressful conditions and to the invasive growth and virulence of Candida albicans." MBio 3(1): 135-150. 10.1128/mbio.00254-11.
24372496	Debinski B, Clegg Smith K, Gielen A. (2014). "Public opinion on motor vehicle-related injury prevention policies: a systematic review of a decade of research." Traffic Inj Prev 15(3): 243-251. 10.1080/15389588.2013.816419.
23384308	Wang J, Du Y, Zhang H, Zhou C, Qi Z, Zheng X, Wang P, Zhang Z. (2013). "The actin-regulating kinase homologue MoArk1 plays a pleiotropic function in Magnaporthe oryzae." Mol Plant Pathol 14(5): 470-482. 10.1111/mpp.12020.
9002270	van Kan JA, van't Klooster JW, Wagemakers CA, Dees DC, van der Vlugt-Bergmans CJ. (1997). "Cutinase A of Botrytis cinerea is expressed, but not essential, during penetration of gerbera and tomato." Mol Plant Microbe Interact 10(1): 30-38. 10.1094/mpmi.1997.10.1.30.
20064064	García-Pedrajas MD, Baeza-Montañez L, Gold SE. (2010). "Regulation of Ustilago maydis dimorphism, sporulation, and pathogenic development by a transcription factor with a highly conserved APSES domain." Mol Plant Microbe Interact 23(2): 211-222. 10.1094/mpmi-23-2-0211.
