14617819	Martchenko M, Alarco AM, Harcus D, Whiteway M. (2004). "Superoxide dismutases in Candida albicans: transcriptional regulation and functional characterization of the hyphal-induced SOD5 gene." Mol Biol Cell 15(2): 456-467. 10.1091/mbc.e03-03-0179.
15271935	Bhabhra R, Miley MD, Mylonakis E, Boettner D, Fortwendel J, Panepinto JC, Postow M, Rhodes JC, Askew DS. (2004). "Disruption of the Aspergillus fumigatus gene encoding nucleolar protein CgrA impairs thermotolerant growth and reduces virulence." Infect Immun 72(8): 4731-4740. 10.1128/iai.72.8.4731-4740.2004.
16404950	Brito N, Espino JJ, González C. (2006). "The endo-beta-1,4-xylanase xyn11A is required for virulence in Botrytis cinerea." Mol Plant Microbe Interact 19(1): 25-32. 10.1094/mpmi-19-0025.
22438810	Mayer FL, Wilson D, Jacobsen ID, Miramón P, Große K, Hube B. (2012). "The novel Candida albicans transporter Dur31 Is a multi-stage pathogenicity factor." PLoS Pathog 8(3): e1002592. 10.1371/journal.ppat.1002592.
14982637	Missall TA, Pusateri ME, Lodge JK. (2004). "Thiol peroxidase is critical for virulence and resistance to nitric oxide and peroxide in the fungal pathogen, Cryptococcus neoformans." Mol Microbiol 51(5): 1447-1458. 10.1111/j.1365-2958.2004.03921.x.
19737099	Wight WD, Kim KH, Lawrence CB, Walton JD. (2009). "Biosynthesis and role in virulence of the histone deacetylase inhibitor depudecin from Alternaria brassicicola." Mol Plant Microbe Interact 22(10): 1258-1267. 10.1094/mpmi-22-10-1258.
23633946	Hall RA, Bates S, Lenardon MD, Maccallum DM, Wagener J, Lowman DW, Kruppa MD, Williams DL, Odds FC, Brown AJ, Gow NA. (2013). "The Mnn2 mannosyltransferase family modulates mannoprotein fibril length, immune recognition and virulence of Candida albicans." PLoS Pathog 9(4): e1003276. 10.1371/journal.ppat.1003276.
24875423	Ridenour JB, Bluhm BH. (2014). "The HAP complex in Fusarium verticillioides is a key regulator of growth, morphogenesis, secondary metabolism, and pathogenesis." Fungal Genet Biol 69(): 52-64. 10.1016/j.fgb.2014.05.003.
18083828	Hallen HE, Trail F. (2008). "The L-type calcium ion channel cch1 affects ascospore discharge and mycelial growth in the filamentous fungus Gibberella zeae (anamorph Fusarium graminearum)." Eukaryot Cell 7(2): 415-424. 10.1128/ec.00248-07.
17624327	Barrio AB, Van Voorhis WC, Basombrío MA. (2007). "Trypanosoma cruzi: attenuation of virulence and protective immunogenicity after monoallelic disruption of the cub gene." Exp Parasitol 117(4): 382-389. 10.1016/j.exppara.2007.05.005.
23438010	Chen LH, Lin CH, Chung KR. (2013). "A nonribosomal peptide synthetase mediates siderophore production and virulence in the citrus fungal pathogen Alternaria alternata." Mol Plant Pathol 14(5): 497-505. 10.1111/mpp.12021.
24970366	Han Y, Han X, Wang S, Meng Q, Zhang Y, Ding C, Yu S. (2014). "The waaL gene is involved in lipopolysaccharide synthesis and plays a role on the bacterial pathogenesis of avian pathogenic Escherichia coli." Vet Microbiol 172(3-4): 486-491. 10.1016/j.vetmic.2014.05.029.
15195943	Burdman S, Shen Y, Lee SW, Xue Q, Ronald P. (2004). "RaxH/RaxR: a two-component regulatory system in Xanthomonas oryzae pv. oryzae required for AvrXa21 activity." Mol Plant Microbe Interact 17(6): 602-612. 10.1094/mpmi.2004.17.6.602.
12819094	Warenda AJ, Kauffman S, Sherrill TP, Becker JM, Konopka JB. (2003). "Candida albicans septin mutants are defective for invasive growth and virulence." Infect Immun 71(7): 4045-4051. 10.1128/iai.71.7.4045-4051.2003.
17020577	Solomon PS, Rybak K, Trengove RD, Oliver RP. (2006). "Investigating the role of calcium/calmodulin-dependent protein kinases in Stagonospora nodorum." Mol Microbiol 62(2): 367-381. 10.1111/j.1365-2958.2006.05380.x.
23185496	Al Abdallah Q, Choe SI, Campoli P, Baptista S, Gravelat FN, Lee MJ, Sheppard DC. (2012). "A conserved C-terminal domain of the Aspergillus fumigatus developmental regulator MedA is required for nuclear localization, adhesion and virulence." PLoS One 7(11): e49959. 10.1371/journal.pone.0049959.
21453433	Li J, Wang N. (2011). "The wxacO gene of Xanthomonas citri ssp. citri encodes a protein with a role in lipopolysaccharide biosynthesis, biofilm formation, stress tolerance and virulence." Mol Plant Pathol 12(4): 381-396. 10.1111/j.1364-3703.2010.00681.x.
24895304	Vu K, Tham R, Uhrig JP, Thompson GR 3rd, Na Pombejra S, Jamklang M, Bautos JM, Gelli A. (2014). "Invasion of the central nervous system by Cryptococcus neoformans requires a secreted fungal metalloprotease." MBio 5(3): e01101-14. 10.1128/mbio.01101-14.
15039366	Singh P, Chauhan N, Ghosh A, Dixon F, Calderone R. (2004). "SKN7 of Candida albicans: mutant construction and phenotype analysis." Infect Immun 72(4): 2390-2394. 10.1128/iai.72.4.2390-2394.2004.
17416896	Liu XH, Lu JP, Zhang L, Dong B, Min H, Lin FC. (2007). "Involvement of a Magnaporthe grisea serine/threonine kinase gene, MgATG1, in appressorium turgor and pathogenesis." Eukaryot Cell 6(6): 997-1005. 10.1128/ec.00011-07.
25058444	Lin FY, Hsiao FP, Huang CY, Shih CM, Tsao NW, Tsai CS, Yang SF, Chang NC, Hung SL, Lin YW. (2014). "Porphyromonas gingivalis GroEL induces osteoclastogenesis of periodontal ligament cells and enhances alveolar bone resorption in rats." PLoS One 9(7): e102450. 10.1371/journal.pone.0102450.
9781884	Marsh JW, Taylor RK. (1998). "Identification of the Vibrio cholerae type 4 prepilin peptidase required for cholera toxin secretion and pilus formation." Mol Microbiol 29(6): 1481-1492. 10.1046/j.1365-2958.1998.01031.x.
11277427	Dufresne M, Osbourn AE. (2001). "Definition of tissue-specific and general requirements for plant infection in a phytopathogenic fungus." Mol Plant Microbe Interact 14(3): 300-307. 10.1094/mpmi.2001.14.3.300.
18448365	Venard C, Kulshrestha S, Sweigard J, Nuckles E, Vaillancourt L. (2008). "The role of a fadA ortholog in the growth and development of Colletotrichum graminicola in vitro and in planta." Fungal Genet Biol 45(6): 973-983. 10.1016/j.fgb.2008.03.008.
23284909	Chen R, Barphagha IK, Karki HS, Ham JH. (2012). "Dissection of quorum-sensing genes in Burkholderia glumae reveals non-canonical regulation and the new regulatory gene tofM for toxoflavin production." PLoS One 7(12): e52150. 10.1371/journal.pone.0052150.
23349662	Basavanna S, Chimalapati S, Maqbool A, Rubbo B, Yuste J, Wilson RJ, Hosie A, Ogunniyi AD, Paton JC, Thomas G, Brown JS. (2013). "The effects of methionine acquisition and synthesis on Streptococcus pneumoniae growth and virulence." PLoS One 8(1): e49638. 10.1371/journal.pone.0049638.
15686555	Bignell E, Negrete-Urtasun S, Calcagno AM, Haynes K, Arst HN Jr, Rogers T. (2005). "The Aspergillus pH-responsive transcription factor PacC regulates virulence." Mol Microbiol 55(4): 1072-1084. 10.1111/j.1365-2958.2004.04472.x.
12421320	Reichmann M, Jamnischek A, Weinzierl G, Ladendorf O, Huber S, Kahmann R, Kämper J. (2002). "The histone deacetylase Hda1 from Ustilago maydis is essential for teliospore development." Mol Microbiol 46(4): 1169-1182. 10.1046/j.1365-2958.2002.03238.x.
11705928	Wang Z, Zheng L, Liu H, Wang Q, Hauser M, Kauffman S, Becker JM, Szaniszlo PJ. (2001). "WdChs2p, a class I chitin synthase, together with WdChs3p (class III) contributes to virulence in Wangiella (Exophiala) dermatitidis." Infect Immun 69(12): 7517-7526. 10.1128/iai.69.12.7517-7526.2001.
21848609	Ben-Daniel BH, Bar-Zvi D, Tsror Lahkim L. (2012). "Pectate lyase affects pathogenicity in natural isolates of Colletotrichum coccodes and in pelA gene-disrupted and gene-overexpressing mutant lines." Mol Plant Pathol 13(2): 187-197. 10.1111/j.1364-3703.2011.00740.x.
23418541	Li YR, Ma WX, Che YZ, Zou LF, Zakria M, Zou HS, Chen GY. (2013). "A highly-conserved single-stranded DNA-binding protein in Xanthomonas functions as a harpin-like protein to trigger plant immunity." PLoS One 8(2): e56240. 10.1371/journal.pone.0056240.
9390419	Mateos FV, Rickauer M, Esquerré-Tugayé MT. (1997). "Cloning and characterization of a cDNA encoding an elicitor of Phytophthora parasitica var. nicotianae that shows cellulose-binding and lectin-like activities." Mol Plant Microbe Interact 10(9): 1045-1053. 10.1094/mpmi.1997.10.9.1045.
10948253	Kim YK, Kawano T, Li D, Kolattukudy PE. (2000). "A mitogen-activated protein kinase kinase required for induction of cytokinesis and appressorium formation by host signals in the conidia of Colletotrichum gloeosporioides." Plant Cell 12(8): 1331-1343. 10.1105/tpc.12.8.1331.
22046959	Li M, Liang X, Rollins JA. (2012). "Sclerotinia sclerotiorum Î³-glutamyl transpeptidase (Ss-Ggt1) is required for regulating glutathione accumulation and development of sclerotia and compound appressoria." Mol Plant Microbe Interact 25(3): 412-420. 10.1094/mpmi-06-11-0159.
10921881	Jia Y, McAdams SA, Bryan GT, Hershey HP, Valent B. (2000). "Direct interaction of resistance gene and avirulence gene products confers rice blast resistance." EMBO J 19(15): 4004-4014. 10.1093/emboj/19.15.4004.
2494098	Surawicz CM, Elmer GW, Speelman P, McFarland LV, Chinn J, van Belle G. (1989). "Prevention of antibiotic-associated diarrhea by Saccharomyces boulardii: a prospective study." Gastroenterology 96(4): 981-988. .
17350264	Jelenska J, Yao N, Vinatzer BA, Wright CM, Brodsky JL, Greenberg JT. (2007). "A J domain virulence effector of Pseudomonas syringae remodels host chloroplasts and suppresses defenses." Curr Biol 17(6): 499-508. 10.1016/j.cub.2007.02.028.
24998435	Wen YT, Wang JS, Tsai SH, Chuan CN, Wu JJ, Liao PC. (2014). "Label-free proteomic analysis of environmental acidification-influenced Streptococcus pyogenes secretome reveals a novel acid-induced protein histidine triad protein A (HtpA) involved in necrotizing fasciitis." J Proteomics 109(): 90-103. 10.1016/j.jprot.2014.06.026.
19154205	Stefanato FL, Abou-Mansour E, Buchala A, Kretschmer M, Mosbach A, Hahn M, Bochet CG, Métraux JP, Schoonbeek HJ. (2009). "The ABC transporter BcatrB from Botrytis cinerea exports camalexin and is a virulence factor on Arabidopsis thaliana." Plant J 58(3): 499-510. 10.1111/j.1365-313x.2009.03794.x.
10755300	Takano Y, Kikuchi T, Kubo Y, Hamer JE, Mise K, Furusawa I. (2000). "The Colletotrichum lagenarium MAP kinase gene CMK1 regulates diverse aspects of fungal pathogenesis." Mol Plant Microbe Interact 13(4): 374-383. 10.1094/mpmi.2000.13.4.374.
23284609	Hennebry SC, Sait LC, Mantena R, Humphrey TJ, Yang J, Scott T, Kupz A, Richardson SJ, Strugnell RA. (2012). "Salmonella typhimurium's transthyretin-like protein is a host-specific factor important in fecal survival in chickens." PLoS One 7(12): e46675. 10.1371/journal.pone.0046675.
9742203	Lau GW, Hamer JE. (1998). "Acropetal: a genetic locus required for conidiophore architecture and pathogenicity in the rice blast fungus." Fungal Genet Biol 24(1-2): 228-239. 10.1006/fgbi.1998.1053.
23071529	Weyrich LS, Rolin OY, Muse SJ, Park J, Spidale N, Kennett MJ, Hester SE, Chen C, Dudley EG, Harvill ET. (2012). "A Type VI secretion system encoding locus is required for Bordetella bronchiseptica immunomodulation and persistence in vivo." PLoS One 7(10): e45892. 10.1371/journal.pone.0045892.
9398674	Csank C, Makris C, Meloche S, Schröppel K, Röllinghoff M, Dignard D, Thomas DY, Whiteway M. (1997). "Derepressed hyphal growth and reduced virulence in a VH1 family-related protein phosphatase mutant of the human pathogen Candida albicans." Mol Biol Cell 8(12): 2539-2551. 10.1091/mbc.8.12.2539.
15640210	Fang W, Leng B, Xiao Y, Jin K, Ma J, Fan Y, Feng J, Yang X, Zhang Y, Pei Y. (2005). "Cloning of Beauveria bassiana chitinase gene Bbchit1 and its application to improve fungal strain virulence." Appl Environ Microbiol 71(1): 363-370. 10.1128/aem.71.1.363-370.2005.
2132028	Kobayashi DY, Tamaki SJ, Keen NT. (1990). "Molecular characterization of avirulence gene D from Pseudomonas syringae pv. tomato." Mol Plant Microbe Interact 3(2): 94-102. .
9119054	Vervoort J, van den Hooven HW, Berg A, Vossen P, Vogelsang R, Joosten MH, de Wit PJ. (1997). "The race-specific elicitor AVR9 of the tomato pathogen Cladosporium fulvum: a cystine knot protein. Sequence-specific 1H NMR assignments, secondary structure and global fold of the protein." FEBS Lett 404(2-3): 153-158. 10.1016/s0014-5793(97)00117-8.
20977307	Cervantes-Chávez JA, Ali S, Bakkeren G. (2011). "Response to environmental stresses, cell-wall integrity, and virulence are orchestrated through the calcineurin pathway in Ustilago hordei." Mol Plant Microbe Interact 24(2): 219-232. 10.1094/mpmi-09-10-0202.
23251490	Oyola SO, Evans KJ, Smith TK, Smith BA, Hilley JD, Mottram JC, Kaye PM, Smith DF. (2012). "Functional analysis of Leishmania cyclopropane fatty acid synthetase." PLoS One 7(12): e51300. 10.1371/journal.pone.0051300.
22634273	Park AR, Cho AR, Seo JA, Min K, Son H, Lee J, Choi GJ, Kim JC, Lee YW. (2012). "Functional analyses of regulators of G protein signaling in Gibberella zeae." Fungal Genet Biol 49(7): 511-520. 10.1016/j.fgb.2012.05.006.
25036004	Bishop AH. (2014). "Expression of prtA from Photorhabdus luminescens in Bacillus thuringiensis enhances mortality in lepidopteran larvae by sub-cutaneous but not oral infection." J Invertebr Pathol 121(): 85-88. 10.1016/j.jip.2014.07.001.
10569785	Kretschmar M, Hube B, Bertsch T, Sanglard D, Merker R, Schröder M, Hof H, Nichterlein T. (1999). "Germ tubes and proteinase activity contribute to virulence of Candida albicans in murine peritonitis." Infect Immun 67(12): 6637-6642. .
23442154	Fan J, Urban M, Parker JE, Brewer HC, Kelly SL, Hammond-Kosack KE, Fraaije BA, Liu X, Cools HJ. (2013). "Characterization of the sterol 14Î±-demethylases of Fusarium graminearum identifies a novel genus-specific CYP51 function." New Phytol 198(3): 821-835. 10.1111/nph.12193.
22346755	Kong LA, Yang J, Li GT, Qi LL, Zhang YJ, Wang CF, Zhao WS, Xu JR, Peng YL. (2012). "Different chitin synthase genes are required for various developmental and plant infection processes in the rice blast fungus Magnaporthe oryzae." PLoS Pathog 8(2): e1002526. 10.1371/journal.ppat.1002526.
22443190	Grahl N, Dinamarco TM, Willger SD, Goldman GH, Cramer RA. (2012). "Aspergillus fumigatus mitochondrial electron transport chain mediates oxidative stress homeostasis, hypoxia responses and fungal pathogenesis." Mol Microbiol 84(2): 383-399. 10.1111/j.1365-2958.2012.08034.x.
23441578	Pliego C, Nowara D, Bonciani G, Gheorghe DM, Xu R, Surana P, Whigham E, Nettleton D, Bogdanove AJ, Wise RP, Schweizer P, Bindschedler LV, Spanu PD. (2013). "Host-induced gene silencing in barley powdery mildew reveals a class of ribonuclease-like effectors." Mol Plant Microbe Interact 26(6): 633-642. 10.1094/mpmi-01-13-0005-r.
12695848	Jenczmionka NJ, Maier FJ, Lösch AP, Schäfer W. (2003). "Mating, conidiation and pathogenicity of Fusarium graminearum, the main causal agent of the head-blight disease of wheat, are regulated by the MAP kinase gpmk1." Curr Genet 43(2): 87-95. .
18600780	Lu Q, Lu JP, Li XD, Liu XH, Min H, Lin FC. (2008). "Magnaporthe oryzae MTP1 gene encodes a type III transmembrane protein involved in conidiation and conidial germination." J Zhejiang Univ Sci B 9(7): 511-519. 10.1631/jzus.b0820015.
23638083	Franklin L, Nobbs AH, Bricio-Moreno L, Wright CJ, Maddocks SE, Sahota JS, Ralph J, O'Connor M, Jenkinson HF, Kadioglu A. (2013). "The AgI/II family adhesin AspA is required for respiratory infection by Streptococcus pyogenes." PLoS One 8(4): e62433. 10.1371/journal.pone.0062433.
3335402	Levine MM, Kaper JB, Herrington D, Losonsky G, Morris JG, Clements ML, Black RE, Tall B, Hall R. (1988). "Volunteer studies of deletion mutants of Vibrio cholerae O1 prepared by recombinant techniques." Infect Immun 56(1): 161-167. .
17616735	Molina L, Kahmann R. (2007). "An Ustilago maydis gene involved in H2O2 detoxification is required for virulence." Plant Cell 19(7): 2293-2309. 10.1105/tpc.107.052332.
22145589	Ipcho SV, Hane JK, Antoni EA, Ahren D, Henrissat B, Friesen TL, Solomon PS, Oliver RP. (2012). "Transcriptome analysis of Stagonospora nodorum: gene models, effectors, metabolism and pantothenate dispensability." Mol Plant Pathol 13(6): 531-545. 10.1111/j.1364-3703.2011.00770.x.
10781092	Alfano JR, Charkowski AO, Deng WL, Badel JL, Petnicki-Ocwieja T, van Dijk K, Collmer A. (2000). "The Pseudomonas syringae Hrp pathogenicity island has a tripartite mosaic structure composed of a cluster of type III secretion genes bounded by exchangeable effector and conserved effector loci that contribute to parasitic fitness and pathogenicity in plants." Proc Natl Acad Sci U S A 97(9): 4856-4861. 10.1073/pnas.97.9.4856.
16151250	Bok JW, Balajee SA, Marr KA, Andes D, Nielsen KF, Frisvad JC, Keller NP. (2005). "LaeA, a regulator of morphogenetic fungal virulence factors." Eukaryot Cell 4(9): 1574-1582. 10.1128/ec.4.9.1574-1582.2005.
15809006	Malz S, Grell MN, Thrane C, Maier FJ, Rosager P, Felk A, Albertsen KS, Salomon S, Bohn L, Schäfer W, Giese H. (2005). "Identification of a gene cluster responsible for the biosynthesis of aurofusarin in the Fusarium graminearum species complex." Fungal Genet Biol 42(5): 420-433. 10.1016/j.fgb.2005.01.010.
9090881	Joosten MH, Vogelsang R, Cozijnsen TJ, Verberne MC, De Wit PJ. (1997). "The biotrophic fungus Cladosporium fulvum circumvents Cf-4-mediated resistance by producing unstable AVR4 elicitors." Plant Cell 9(3): 367-379. 10.1105/tpc.9.3.367.
12496163	Cox GM, Harrison TS, McDade HC, Taborda CP, Heinrich G, Casadevall A, Perfect JR. (2003). "Superoxide dismutase influences the virulence of Cryptococcus neoformans by affecting growth within macrophages." Infect Immun 71(1): 173-180. 10.1128/iai.71.1.173-180.2003.
25093328	Lo Sciuto A, Fernández-Piñar R, Bertuccini L, Iosi F, Superti F, Imperi F. (2014). "The periplasmic protein TolB as a potential drug target in Pseudomonas aeruginosa." PLoS One 9(8): e103784. 10.1371/journal.pone.0103784.
23437265	Iwata T, Chiku K, Amano K, Kusumoto M, Ohnishi-Kameyama M, Ono H, Akiba M. (2013). "Effects of lipooligosaccharide inner core truncation on bile resistance and chick colonization by Campylobacter jejuni." PLoS One 8(2): e56900. 10.1371/journal.pone.0056900.
10432635	Tanaka A, Shiotani H, Yamamoto M, Tsuge T. (1999). "Insertional mutagenesis and cloning of the genes required for biosynthesis of the host-specific AK-toxin in the Japanese pear pathotype of Alternaria alternata." Mol Plant Microbe Interact 12(8): 691-702. 10.1094/mpmi.1999.12.8.691.
11854524	Fouts DE, Abramovitch RB, Alfano JR, Baldo AM, Buell CR, Cartinhour S, Chatterjee AK, D'Ascenzo M, Gwinn ML, Lazarowitz SG, Lin NC, Martin GB, Rehm AH, Schneider DJ, van Dijk K, Tang X, Collmer A. (2002). "Genomewide identification of Pseudomonas syringae pv. tomato DC3000 promoters controlled by the HrpL alternative sigma factor." Proc Natl Acad Sci U S A 99(4): 2275-2280. 10.1073/pnas.032514099.
23300718	Bhat KH, Ahmed A, Kumar S, Sharma P, Mukhopadhyay S. (2012). "Role of PPE18 protein in intracellular survival and pathogenicity of Mycobacterium tuberculosis in mice." PLoS One 7(12): e52601. 10.1371/journal.pone.0052601.
23594349	Yin W, Dong S, Zhai L, Lin Y, Zheng X, Wang Y. (2013). "The Phytophthora sojae Avr1d gene encodes an RxLR-dEER effector with presence and absence polymorphisms among pathogen strains." Mol Plant Microbe Interact 26(8): 958-968. 10.1094/mpmi-02-13-0035-r.
25044543	Garcia-Gonzalez E, Müller S, Hertlein G, Heid N, Süssmuth RD, Genersch E. (2014). "Biological effects of paenilamicin, a secondary metabolite antibiotic produced by the honey bee pathogenic bacterium Paenibacillus larvae." Microbiologyopen 3(5): 642-656. 10.1002/mbo3.195.
12581357	Hwang CS, Oh JH, Huh WK, Yim HS, Kang SO. (2003). "Ssn6, an important factor of morphological conversion and virulence in Candida albicans." Mol Microbiol 47(4): 1029-1043. 10.1046/j.1365-2958.2003.03353.x.
18216277	Banerjee M, Thompson DS, Lazzell A, Carlisle PL, Pierce C, Monteagudo C, López-Ribot JL, Kadosh D. (2008). "UME6, a novel filament-specific regulator of Candida albicans hyphal extension and virulence." Mol Biol Cell 19(4): 1354-1365. 10.1091/mbc.e07-11-1110.
23326232	Marrero J, Trujillo C, Rhee KY, Ehrt S. (2013). "Glucose phosphorylation is required for Mycobacterium tuberculosis persistence in mice." PLoS Pathog 9(1): e1003116. 10.1371/journal.ppat.1003116.
20663961	Treitschke S, Doehlemann G, Schuster M, Steinberg G. (2010). "The myosin motor domain of fungal chitin synthase V is dispensable for vesicle motility but required for virulence of the maize pathogen Ustilago maydis." Plant Cell 22(7): 2476-2494. 10.1105/tpc.110.075028.
9927411	Urban M, Bhargava T, Hamer JE. (1999). "An ATP-driven efflux pump is a novel pathogenicity factor in rice blast disease." EMBO J 18(3): 512-521. 10.1093/emboj/18.3.512.
7500937	Takano Y, Kubo Y, Shimizu K, Mise K, Okuno T, Furusawa I. (1995). "Structural analysis of PKS1, a polyketide synthase gene involved in melanin biosynthesis in Colletotrichum lagenarium." Mol Gen Genet 249(2): 162-167. 10.1007/bf00290362.
23634775	Degrave A, Moreau M, Launay A, Barny MA, Brisset MN, Patrit O, Taconnat L, Vedel R, Fagard M. (2013). "The bacterial effector DspA/E is toxic in Arabidopsis thaliana and is required for multiplication and survival of fire blight pathogen." Mol Plant Pathol 14(5): 506-517. 10.1111/mpp.12022.
24996230	Haas B, Bonifait L, Vaillancourt K, Charette SJ, Gottschalk M, Grenier D. (2014). "Characterization of DNase activity and gene in Streptococcus suis and evidence for a role as virulence factor." BMC Res Notes 7(): 424. 10.1186/1756-0500-7-424.
14665454	Müller P, Weinzierl G, Brachmann A, Feldbrügge M, Kahmann R. (2003). "Mating and pathogenic development of the Smut fungus Ustilago maydis are regulated by one mitogen-activated protein kinase cascade." Eukaryot Cell 2(6): 1187-1199. 10.1128/ec.2.6.1187-1199.2003.
20526618	Saitoh Y, Izumitsu K, Morita A, Tanaka C. (2010). "A copper-transporting ATPase BcCCC2 is necessary for pathogenicity of Botrytis cinerea." Mol Genet Genomics 284(1): 33-43. 10.1007/s00438-010-0545-4.
11994163	Richard M, Ibata-Ombetta S, Dromer F, Bordon-Pallier F, Jouault T, Gaillardin C. (2002). "Complete glycosylphosphatidylinositol anchors are required in Candida albicans for full morphogenesis, virulence and resistance to macrophages." Mol Microbiol 44(3): 841-853. 10.1046/j.1365-2958.2002.02926.x.
12892639	Amey RC, Mills PR, Bailey A, Foster GD. (2003). "Investigating the role of a Verticillium fungicola beta-1,6-glucanase during infection of Agaricus bisporus using targeted gene disruption." Fungal Genet Biol 39(3): 264-275. 10.1016/s1087-1845(03)00061-6.
24919412	Vanhove AS, Duperthuy M, Charrière GM, Le Roux F, Goudenège D, Gourbal B, Kieffer-Jaquinod S, Couté Y, Wai SN, Destoumieux-Garzón D. (2014). "Outer membrane vesicles are vehicles for the delivery of Vibrio tasmaniensis virulence factors to oyster immune cells." Environ Microbiol (): . .
23322637	O'Meara TR, Holmer SM, Selvig K, Dietrich F, Alspaugh JA. (2013). "Cryptococcus neoformans Rim101 is associated with cell wall remodeling and evasion of the host immune responses." MBio 4(1): . 10.1128/mbio.00522-12.
11204774	Ruiz-Roldán MC, Maier FJ, Schäfer W. (2001). "PTK1, a mitogen-activated-protein kinase gene, is required for conidiation, appressorium formation, and pathogenicity of Pyrenophora teres on barley." Mol Plant Microbe Interact 14(2): 116-125. 10.1094/mpmi.2001.14.2.116.
14555479	Latijnhouwers M, Govers F. (2003). "A Phytophthora infestans G-protein beta subunit is involved in sporangium formation." Eukaryot Cell 2(5): 971-977. 10.1128/ec.2.5.971-977.2003.
15141959	Li L, Xue C, Bruno K, Nishimura M, Xu JR. (2004). "Two PAK kinase genes, CHM1 and MST20, have distinct functions in Magnaporthe grisea." Mol Plant Microbe Interact 17(5): 547-556. 10.1094/mpmi.2004.17.5.547.
14769793	van den Burg HA, Spronk CA, Boeren S, Kennedy MA, Vissers JP, Vuister GW, de Wit PJ, Vervoort J. (2004). "Binding of the AVR4 elicitor of Cladosporium fulvum to chitotriose units is facilitated by positive allosteric protein-protein interactions: the chitin-binding site of AVR4 represents a novel binding site on the folding scaffold shared between the invertebrate and the plant chitin-binding domain." J Biol Chem 279(16): 16786-16796. 10.1074/jbc.m312594200.
23300893	Xu Q, Shi Y, Dadhwal P, Liang FT. (2012). "RpoS regulates essential virulence factors remaining to be identified in Borrelia burgdorferi." PLoS One 7(12): e53212. 10.1371/journal.pone.0053212.
23762452	Dahal N, Abdelhamed H, Lu J, Karsi A, Lawrence ML. (2013). "Tricarboxylic acid cycle and one-carbon metabolism pathways are important in Edwardsiella ictaluri virulence." PLoS One 8(6): e65973. 10.1371/journal.pone.0065973.
12100546	Bai C, Ramanan N, Wang YM, Wang Y. (2002). "Spindle assembly checkpoint component CaMad2p is indispensable for Candida albicans survival and virulence in mice." Mol Microbiol 45(1): 31-44. 10.1046/j.1365-2958.2002.02995.x.
23071437	Morrow CA, Valkov E, Stamp A, Chow EW, Lee IR, Wronski A, Williams SJ, Hill JM, Djordjevic JT, Kappler U, Kobe B, Fraser JA. (2012). "De novo GTP biosynthesis is critical for virulence of the fungal pathogen Cryptococcus neoformans." PLoS Pathog 8(10): e1002957. 10.1371/journal.ppat.1002957.
19197359	Doehlemann G, van der Linde K, Assmann D, Schwammbach D, Hof A, Mohanty A, Jackson D, Kahmann R. (2009). "Pep1, a secreted effector protein of Ustilago maydis, is required for successful invasion of plant cells." PLoS Pathog 5(2): e1000290. 10.1371/journal.ppat.1000290.
21249145	Ngamskulrungroj P, Price J, Sorrell T, Perfect JR, Meyer W. (2011). "Cryptococcus gattii virulence composite: candidate genes revealed by microarray analysis of high and less virulent Vancouver island outbreak strains." PLoS One 6(1): e16076. 10.1371/journal.pone.0016076.
